Competency Title,Notation,Competency Definition,,,,
Forensics,,"Knowledge of procedures of civil, criminal, or administrative hearings, evidence collection, including the delivery and receipt of evidence, classes of evidence, and rules of evidence and legal procedures.",,,,
Forest Management,,"Knowledge of the concepts, principles, and theories of silviculture and forest ecology, forest use, management, harvesting, conducting inventories, regeneration, sustainability, and conservation; and the role of disturbances in timberland resources.",,,,
General Engineering,,"Knowledge of the concepts, principles, and theories of engineering and their practical applications.",,,,
Genetics,,"Knowledge of the concepts, principles, and theories of genetics, including the biochemistry of DNA, gene interaction, gene expression, gene inheritance, population genetics, adaptation, and evolution.",,,,
Geography,,"Knowledge of geographical locations, their relationships and characteristics.",,,,
Geographical Sciences,,"Knowledge of the concepts, principles, theories, and methods for describing the location and distribution of land, sea, and air masses, including their physical locations, relationships, characteristics, and what the land supports.",,,,
Geology,,"Knowledge of the concepts, principles, and theories of the origins and structure of the earth, including the physical forces that have shaped it and its physical and organic history.",,,,
Geophysics,,"Knowledge of the concepts, principles, and theories related to solid earth structure, global seismic patterns, lithosphere, atmosphere, and the behavior of the earth’s gravitational, magnetic, and electrical fields, and other forces affecting the earth and its environment.",,,,
Geotechnical Engineering,,"Knowledge of the concepts, principles, theories, and methods related to the investigation and evaluation of subsurface soil or geologic conditions and properties for the purpose of designing stable foundation systems, earthen structures, or the remediation of subsurface conditions.",,,,
Grants Management,,"Knowledge of requirements, practices, and procedures for soliciting, receiving, reviewing, and processing proposals, and awarding and administering grants and agreements.",,,,
"Grants Management Laws, Regulations, and Guidelines",,"Knowledge of principles, laws, regulations, policies, practices, and guidelines (for example, Executive Orders, Code of Federal Regulations, OMB circulars) of grant or agreement programs, including their order of precedence.",,,,
Hardware,,"Knowledge of specifications, uses, and types of computer or computer-related equipment.",,,,
Hardware Engineering,,"Knowledge of the principles, methods, and tools for designing, developing, and testing computer or computer-related equipment.",,,,
Hazardous Materials,,"Knowledge of hazardous materials and waste and their uses, interactions, dangers, production, handling, storage, and disposal.",,,,
Health Physics,,"Knowledge of the concepts, principles, theories, and methods pertaining to the protection of people, their environment, and equipment from hazards (for example, radiation or hazardous chemicals) and the control of radioactive material.",,,,
History and Archeology,,"Knowledge of historical events and their causes, indicators, and impact on particular civilization and cultures, and of preservation and archival techniques.",,,,
Horticulture,,"Knowledge of cultivating flowers, plants, and trees.",,,,
Horticultural Sciences,,"Knowledge of the concepts, principles, theories, and practices of cultivation or crop management, physiological processes in plant growth and crop yield.",,,,
HR Information Systems,,"Knowledge of HR management concepts, principles, and practices related to identifying and analyzing HR processes, translating functional requirements into technical requirements, and delivering and maintaining HR information systems.",,,,
Human Capital Management,,"Builds and manages workforce based on organizational goals, budget considerations, and staffing needs. Ensures that employees are appropriately recruited, selected, appraised, and rewarded; takes action to address performance problems. Manages a multi-sector workforce and a variety of work situations.",,,,
Human Factors,,"Knowledge of the principles, methods, and tools used to identify and apply information about human behavior, abilities, limitations, and other characteristics to the design of tools, machines, systems, tasks, jobs, and environments for effective human use.",,,,
Hydraulic Engineering,,"Knowledge of the concepts, principles, theories, and methods applicable to analysis of the flow of fluids (open channel and pressure flow), estimation of river stages, and design of hydraulic structures, drainage structures, pipes, navigation facilities, reservoirs, locks, and dams.",,,,
Hydrology,,"Knowledge of the concepts, principles, theories, and methods related to the magnitude, distribution, and quality of water resources including watershed management, climatology, geomorphology, groundwater hydrology, water quality, water resource management, and groundwater/surface water interactions.",,,,
Identity Management,,"Knowledge of methods and controls to validate the identity of individuals to verify access approval and level, and monitor activity to ensure that only authorized access is taking place.",,,,
Incident Management,,"Knowledge of the tactics, technologies, principles, and processes to protect, analyze, prioritize, and handle incidents.",,,,
Industrial Equipment Operation,,Knowledge of principles and methods for operating industrial equipment.,,,,
Influencing/Negotiating (*),(*),"Persuades others to accept recommendations, cooperate, or change their behavior; works with others towards an agreement; negotiates to find mutually acceptable solutions.",,,,
Influencing/Negotiating (‡),(‡),Persuades others, builds consensus through give and take, gains cooperation from others to obtain information and accomplish goals.,,
Information Assurance,,"Knowledge of methods and procedures to protect information systems and data by ensuring their availability, authentication, confidentiality, and integrity.",,,,
Information Management,,Identifies a need for and knows where or how to gather information, organizes and maintains information or information management systems.,,,
Information Resources Strategy and Planning,,"Knowledge of the principles, methods, and techniques of information technology (IT) assessment, planning, management, monitoring, and evaluation, such as IT baseline assessment, interagency functional analysis, contingency planning, and disaster recovery.",,,,
Information Systems Security Certification,,"Knowledge of the principles, methods, and tools for evaluating information systems security features against a set of specified security requirements. Includes developing security certification and accreditation plans and procedures, documenting deficiencies, reporting corrective actions, and recommending changes to improve the security of information systems.",,,,
Information Systems/Network Security,,"Knowledge of methods, tools, and procedures, including development of information security plans, to prevent information systems vulnerabilities, and provide or restore security of information systems and network services.",,,,
Information Technology Architecture,,"Knowledge of architectural methodologies used in the design and development of information systems, including the physical structure of a system's internal operations and interactions with other systems.",,,,
Information Technology Performance Assessment,,"Knowledge of the principles, methods, and tools (for example, surveys, system performance measures) to assess the effectiveness and practicality of information technology systems.",,,,
Information Technology Program Management,,"Knowledge of the principles, methods, and tools for the coordinated management of an IT program to include providing oversight of multiple IT projects, integrating dependent schedules and deliverables, and related activities (for example, benefits management, life cycle management, program governance).",,,,
Information Technology Research and Development,,"Knowledge of scientific principles, methods, and tools of basic and applied research used to conduct a systematic inquiry into a subject matter area.",,,,
Infrastructure Design,,"Knowledge of the architecture and typology of software, hardware, and networks, including LANS, WANS, and telecommunications systems, their components and associated protocols and standards, and how they operate and integrate with one another and with associated controlling software.",,,,
Insurance,,"Knowledge of various types of insurance, insurance regulations, claims processing, examination, adjudication, or adjustment.",,,,
Integrity/Honesty (*),(*),"Contributes to maintaining the integrity of the organization; displays high standards of ethical conduct and understands the impact of violating these standards on an organization, self, and others; is trustworthy.",,,,
Integrity/Honesty (‡),(‡),"Behaves in an honest, fair, and ethical manner. Shows consistency in words and actions. Models high standards of ethics.",,,,
Internal Controls,,"Knowledge of the principles, methods, and techniques for establishing internal control activities (for example, authorizations, verifications, reconciliations), monitoring their use, and evaluating their performance (for example, identification of material weaknesses or significant deficiencies).",,,,
Interpersonal Skills (*),(*),"Shows understanding, friendliness, courtesy, tact, empathy, concern, and politeness to others; develops and maintains effective relationships with others; may include effectively dealing with individuals who are difficult, hostile, or distressed; relates well to people from varied backgrounds and different situations; is sensitive to cultural diversity, race, gender, disabilities, and other individual differences.",,,,
Interpersonal Skills (‡),(‡),"Treats others with courtesy, sensitivity, and respect.  Considers and responds appropriately to the needs and feelings of different people in different situations.",,,,
IT Modeling and Simulation,,"Knowledge of mathematical modeling and simulation tools and techniques to plan and conduct test and evaluation programs, characterize systems support decisions involving requirements, evaluate design alternatives, or support operational preparation.",,,,
Knowledge Management,,Knowledge of the value of collected information and the methods of sharing that information throughout an organization.,,,,
Labor Law,,"Knowledge of state and Federal employment laws, regulations, guidelines, and legal precedents related to hiring practices, equal employment opportunity, and wage and hour restrictions.",,,,
Labor Relations,,"Knowledge of laws, rules, regulations, case law, principles, and practices related to negotiating and administering labor agreements.",,,,
Landscape Architecture,,"Knowledge of the concepts, theories, and practices used in the planning, designing, construction, and adaptation of outdoor features, taking into consideration recreation planning, requirements, aesthetic value, and compatibility with other developments and resources.",,,,
Leadership,,"Influences, motivates, and challenges others; adapts leadership styles to a variety of situations.",,,,
Learning,,"Uses efficient learning techniques to acquire and apply new knowledge and skills; uses training, feedback, or other opportunities for self-learning and development.",,,,
"Legal, Government, and Jurisprudence",,"Knowledge of laws, legal codes, court procedures, precedents, legal practices and documents, Government regulations, Executive orders, agency rules, Government organization and functions, and the democratic political process.",,,,
Leveraging Diversity,,Fosters an inclusive workplace where diversity and individual differences are valued and leveraged to achieve the vision and mission of the organization.,,,,
Life Sciences and Systems,,Knowledge of life sciences that involve the theoretical and experimental research of life systems.,,,,
Listening,,"Receives, attends to, interprets, and responds to verbal messages and other cues such as body language in ways that are appropriate to listeners and situations.",,,,
Logical Systems Design,,"Knowledge of the principles and methods for designing business logic components, system processes and outputs, user interfaces, data inputs, and productivity tools (for example, computer-aided software engineering).",,,,
Manages and Organizes Information,,"Identifies a need; gathers, organizes, and maintains information; determines its importance and accuracy, and communicates it by a variety of methods.",,,,
Manages Human Resources,,"Plans, distributes, and monitors work assignments; evaluates work performance and provides feedback to others on their performance.",,,,
Manages Resources,,"Selects, acquires, stores, and distributes resources such as materials, equipment, or money.",,,,
Managing Human Resources,,"Plans, distributes, coordinates, and monitors work assignments of others; evaluates work performance and provides feedback to others on their performance; ensures that staff are appropriately selected, utilized, and developed, and that they are treated in a fair and equitable manner.",,,,
Manufacturing,,"Knowledge of the specifications, tools, inputs, raw materials, outputs, and waste related to the manufacture of prototypes, models, systems, or other products.",,,,
Materials Engineering,,"Knowledge of the concepts, principles, theories, and methods related to the composition, structures, and properties of materials, their use, behavior and performance under environmental influences, and the identification, processing, and manufacture of optimal materials for various applications.",,,,
Mathematical Reasoning,,Solves practical problems by choosing appropriately from a variety of mathematical and statistical techniques.,,,,
Measurement and Instrumentation,,"Knowledge of electronics and related electrical engineering disciplines necessary for the research and development of sensors, electronic measurement devices, and instrumentation systems for aerospace systems and components.",,,,
Mechanical (*),(*),"Knowledge of machines and tools, including their designs, uses, benefits, repair, and maintenance.",,,,
Mechanical (†),(†),"Knowledge of machines and tools, including their designs, installation, uses, repair, and maintenance.",,,,
Mechanical Engineering,,"Knowledge of the concepts, principles, theories, and methods related to planning, designing, developing, testing, or evaluating thermodynamic, mechanical, electro-mechanical, pneumatic, hydraulic, or structural equipment, systems, models, tools, or specialized mechanical devices.",,,,
Mechanics,,"Knowledge of machines and tools, including their design, use, benefits, repair, operation, and maintenance.",,,,
Medicine and Dentistry,,"Knowledge of the diagnosis and treatment of injuries, diseases, and deformities, including preventive health-care measures.",,,,
Memory,,Recalls information that has been presented previously.,,,,
Mental Visualization,,"Sees things in the mind by mentally organizing and processing symbols, pictures, graphs, objects, or other information (for example, sees a building from a blueprint, or sees the flow of work activities from reading a work plan).",,,,
Metal Processing and Metalworking,,"Knowledge of materials, methods, and appropriate tools to process, treat, form, or shape metal.",,,,
Metallurgy,,"Knowledge of the concepts, principles, and theories related to the study of extracting, refining, alloying, and preparing metals for use; and their properties and behavior as affected by the composition, treatment in manufacture, and conditions of use.",,,,
Mine Safety and Health,,"Knowledge of mine safety and health principles and practices, techniques and procedures, regulations, and standards as they apply to conducting inspections/investigations, identifying and evaluating unsafe conditions, and recommending methods to correct unsafe conditions.",,,,
Mining Engineering,,"Knowledge of the concepts, principles, theories, and methods related to rock mechanics; the exploration, excavation, extraction, processing and transporting of mineral resources; and the conservation and development of mineral lands, materials, and deposits.",,,,
Modeling and Simulation,,"Knowledge of the tools and techniques used to develop functional, physical, or prototype models and simulations for test and evaluation programs, the prediction of behavior and phenomena, and to visually communicate concepts.",,,,
Multimedia Technologies,,"Knowledge of the principles, methods, tools, and techniques to develop or apply technology using text, audio, graphics, or other media.",,,,
Negotiation,,Works with others towards an agreement that may involve exchanging specific resources or resolving differences.,,,,
Network Management,,"Knowledge of the operation, management, and maintenance of network and telecommunication systems and linked systems and peripherals.",,,,
Nuclear Engineering,,"Knowledge of the concepts, principles, theories, and application of nuclear technologies including research, development, construction, operation, testing, and maintenance of nuclear reactors, radiation generating devices, and associated systems and equipment.",,,,
Nuclear Physics,,"Knowledge of the concepts, principles, theories, and methods related to the prediction of nuclear interactions and reactions, including practices and methods used to produce, measure, use, or observe such reactions in stars, nuclear weapons systems, and radiation shielding.",,,,
Object Technology,,"Knowledge of the principles, methods, tools, and techniques that use object-oriented languages, analysis, and design methodologies.",,,,
Operating Systems,,"Knowledge of computer network, desktop, and mainframe operating systems and their applications.",,,,
Operations,,"Knowledge of engineering or physical science disciplines to support space flight operations, training or planning; serving as an astronaut or mission specialist.",,,,
Operations Support,,"Knowledge of procedures to ensure production or delivery of products and services, including tools and mechanisms for distributing new or enhanced software.",,,,
Oral Communication (*),(*),"Expresses information (for example, ideas or facts) to individuals or groups effectively, taking into account the audience and nature of the information (for example, technical, sensitive, controversial); makes clear and convincing oral presentations; listens to others, attends to nonverbal cues, and responds appropriately.",,,,
Oral Communication (‡),(‡),Makes clear and convincing oral presentations. Listens effectively, clarifies information as needed.,,,
Organizational Awareness,,"Knows the organization's mission and functions, and how its social, political, and technological systems work and operates effectively within them; this includes the programs, policies, procedures, rules, and regulations of the organization.",,,,
Organizational Development,,"Knowledge of the principles of organizational development and change management theories, and their applications.",,,,
Organizational Performance Analysis,,"Knowledge of the methods, techniques, and tools used to analyze program, organizational, and mission performance; includes methods that deliver key performance information (for example, comparative, trend, diagnostic, root cause, predictive) used to inform decisions, actions, communications, and accountability systems.",,,,
Painting,,"Knowledge of materials, methods, and appropriate tools to apply paint and other protective coating materials on drywall, wood, metal, glass, and other surfaces.",,,,
Partnering,,Develops networks and builds alliances, collaborates across boundaries to build strategic relationships and achieve common goals.,,,
Pathology,,"Knowledge of the concepts, principles, and theories of plant, insect, or animal diseases and host/pathogen relationships, including effects on natural and managed ecosystems.",,,,
Perceptual Speed,,"Quickly and accurately sees detail in words, numbers, pictures, and graphs.",,,,
Performance Management,,"Knowledge of performance management concepts, principles, and practices related to planning, monitoring, rating, and rewarding employee performance.",,,,
Performance Measurement,,"Knowledge of the principles and methods for evaluating program or organizational performance using financial and nonfinancial measures, including identification of evaluation factors (for example, workload, personnel requirements), metrics, and outcomes.",,,,
Peripheral Vision,,Sees objects or movement of objects to one’s side when the eyes are focused forward.,,,,
Personnel and Human Resources,,"Knowledge of hiring, classification, benefits, labor relations, negotiation, and Federal, state, and local employment regulations.",,,,
Personnel Security and Safety,,"Knowledge of methods and controls of personnel, public safety, and security operations; investigation and inspection techniques; or rules, regulations, precautions, and prevention techniques for the protection of people, data, or property.",,,,
Pest Control,,"Knowledge of pest species and the methods and materials, including chemicals, for control or prevention.",,,,
Petroleum Engineering,,"Knowledge of the concepts, principles, theories, and methods related to the exploration, development, extraction, recovery, processing, and conservation of fluid minerals, geothermal resources, organic compounds, or natural gas resources.",,,,
Philosophy,,"Knowledge of different philosophical systems, including their basic principles, values, ethics, ways of  thinking, customs, religions, and practices, and their impact on human culture.",,,,
Physical Security,,"Knowledge of methods and controls to protect an organization from natural or man-made threats to physical locations where information systems equipment is located or work is performed (for example, computer rooms, work locations, and equipment rooms).",,,,
Physical Strength,,"Exerts maximum muscle force to lift, push, pull, or carry objects; performs moderately laboring work.",,,,
Physical Strength and Agility,,"Ability to bend, lift, climb, stand, and walk for long periods of time; ability to perform moderately heavy laboring work.",,,,
Physics,,"Knowledge and prediction of physical principles, laws, and applications including air, water, material dynamics, light, atomic principles, heat, electric theory, earth formations, and meteorological and related natural phenomena.",,,,
Physical Sciences,,"Knowledge of the concepts, principles, theories, and methods to investigate and apply the relations between space, time, matter, and energy in the areas of gravity, atomic principles, mechanics, heat, light, sound, electricity, magnetism, and related natural phenomena.",,,,
Planning and Evaluating,,"Organizes work, sets priorities, and determines resource requirements; determines short- or long-term goals and strategies to achieve them; coordinates with other organizations or parts of the organization to accomplish goals; monitors progress and evaluates outcomes.",,,,
Plumbing and Pipefitting,,"Knowledge of materials, methods, and the appropriate tools to install, maintain, or repair pipelines, pipe systems, and fixtures, including water, air, steam, gas, chemicals, or sewage.",,,,
Political Savvy,,Identifies the internal and external politics that impact the work of the organization. Perceives organizational and political reality and acts accordingly.,,,,
Principles of Accounting,,"Knowledge of generally accepted accounting principles, standards, and practices (for example, double entry accounting, accrual accounting), including the full accounting cycle and the preparation of work sheets, financial statements, ledgers, and journals.",,,,
Principles of Finance,,"Knowledge of the basic principles, practices, and methods of financial management to include requisitions, apportionments, allotments, investments, fiscal management, activity reporting, and fiscal year guidelines.",,,,
Problem Solving (*),(*),"Identifies problems; determines accuracy and relevance of information; uses sound judgment to generate and evaluate alternatives, and to make recommendations.",,,,
Problem Solving (‡),(‡),Identifies and analyzes problems, weighs relevance and accuracy of information, generates and evaluates alternative solutions, makes recommendations.,
Process Control,,"Knowledge of the principles, methods, and procedures used for the automated control of a process, including the design, development, and maintenance of associated software, hardware, and systems.",,,,
Product Evaluation,,Knowledge of methods for researching and analyzing external products to determine their potential for meeting organizational standards and business needs.,,,,
Production and Processing,,"Knowledge of inputs, outputs, raw materials, waste, quality control, costs, maintaining inventory, and techniques for maximizing the manufacture and distribution of goods.",,,,
Project Management,,"Knowledge of the principles, methods, or tools for developing, scheduling, coordinating, and managing projects and resources, including monitoring and inspecting costs, work, and contractor performance.",,,,
Propulsion and Power,,"Knowledge of the concepts, principles, and theories of liquid, solid, electrical, chemical, electrochemical, or nuclear propulsion and power generation systems, their component parts and subsystems, and the direct and indirect conversion of energy into power for various applications.",,,,
Psychology,,"Knowledge of the concepts, principles, and theories of human behavior and performance in various contexts, mental processes, or the assessment and treatment of behavioral and affective disorders.",,,,
